date,review,rating,thumbs_up,cleaned_review,sentiment_label,sentiment_score,sentiment
2024-06-05 01:19:57,"It was an unpleasant experience, a proprty was posted terminated while Agent said is available another property was planned for this upcoming open house , I planned to visit I recived notification was sold yesterday. It is not accurate. As much as I experienced difficulty but I like its mapping. You can easily search on the map and see the listing . Another inaccurate information on a property.",4,7,unpleasant experience proprty post terminate agent say available property plan upcoming open house plan visit recive notification sell yesterday accurate experience difficulty like mapping easily search map listing inaccurate information property,NEGATIVE,-0.9980619549751282,negative
2024-05-23 03:41:13,The photos never load or only half load. App is constantly glitchy,1,0,photo load half load app constantly glitchy,NEGATIVE,-0.9994557499885559,negative
2024-05-21 20:46:06,very user friendly,5,0,user friendly,POSITIVE,0.9775891304016113,positive
2024-05-16 17:39:23,excellent source of information on a variety of homes on the market,5,0,excellent source information variety home market,POSITIVE,0.9996976852416992,positive
2024-05-14 16:41:47,awesome app. You don't need an agent with this app.,5,0,awesome app need agent app,POSITIVE,0.999586284160614,positive
2024-05-11 20:43:20,Great app but lacks the ability to filter on acreage.,4,0,great app lack ability filter acreage,NEGATIVE,-0.8870480060577393,negative
2024-05-06 01:05:26,gives a lot of information,5,0,give lot information,POSITIVE,0.998950719833374,positive
2024-04-29 05:06:58,I like the filters for viewing on the map and also the growth estimate could really come in handy.,4,0,like filter view map growth estimate come handy,POSITIVE,0.9496138691902161,positive
2024-04-28 23:31:32,very useful,5,0,useful,POSITIVE,0.9997634291648865,positive
2024-04-23 19:47:47,"easy to use, lots of info",5,0,easy use lot info,POSITIVE,0.8641505241394043,positive
2024-04-22 00:19:25,Very useful and informative. Recently hit a snag on some milton and Oakville areas. Password expired . What does that mean,4,0,useful informative recently hit snag milton oakville area password expire mean,POSITIVE,0.7261966466903687,positive
2024-04-20 08:31:33,"Great info of any property history at your fingertips. Fantastic job House sigma, well done",4,0,great info property history fingertip fantastic job house sigma,POSITIVE,0.9996359348297119,positive
2024-04-17 07:01:57,Excellent,5,0,excellent,POSITIVE,0.9998434782028198,positive
2024-04-17 02:42:09,Good app. I like almost everything. Would be nice to be able to specify lot width to the foot (instead of 10' increments). Would also be nice to specify sold date history to the day.,4,0,good app like nice able specify lot width foot instead increment nice specify sell date history day,POSITIVE,0.968586802482605,positive
2024-04-16 05:40:24,Hope VR could be added so that we can have a more thorough understanding.,4,0,hope add thorough understanding,POSITIVE,0.9998190999031067,positive
2024-04-14 22:43:57,very informative.,5,0,informative,POSITIVE,0.99977046251297,positive
2024-04-12 00:54:21,love being able to view past prices and compare,5,0,love able view past price compare,POSITIVE,0.999121367931366,positive
2024-04-02 23:43:26,"Housesigma excels as a premier real estate portal, offering both a user-friendly website and a seamlessly functional mobile app. Its performance is marked by speed, reliability, and a wealth of information. The Estimate Price feature stands out as particularly valuable, providing precise estimations of property values to aid buyers in securing the best deals. With a responsive and friendly sales team, Housesigma ensures swift assistance and a positive user experience. Love this app",5,0,housesigma excel premier real estate portal offer user friendly website seamlessly functional mobile app performance mark speed reliability wealth information estimate price feature stand particularly valuable provide precise estimation property value aid buyer secure good deal responsive friendly sale team housesigma ensure swift assistance positive user experience love app,POSITIVE,0.9985324144363403,positive
2024-03-30 11:41:36,Well organized and fairly good information,5,0,organized fairly good information,POSITIVE,0.9998383522033691,positive
2024-03-30 02:41:04,"I like the app idea, but it doesn't have Quebec/Montreal in it unfortunately so it's useless for me.",3,1,like app idea quebec montreal unfortunately useless,NEGATIVE,-0.9994964599609375,negative
2024-03-29 21:45:37,nice app. u don't need to call a realtor to give you price of any property to compare.,5,2,nice app need realtor price property compare,POSITIVE,0.9807220697402954,positive
2024-03-26 18:19:00,Good details,5,0,good detail,POSITIVE,0.9998384714126587,positive
2024-03-26 01:33:37,"Very beautiful app, quick and responsive!",5,0,beautiful app quick responsive,POSITIVE,0.9998106360435486,positive
2024-03-25 07:22:37,preferred app after comparison with others. Bravo!!!,5,0,preferred app comparison bravo,NEGATIVE,-0.7825912237167358,negative
2024-03-24 20:21:03,fantastic app for recon when you are looking to buy/sell,4,0,fantastic app recon look buy sell,POSITIVE,0.9997573494911194,positive
2024-03-20 07:06:11,Please add a dark mode. A lot of listing pictures are not loading.,3,1,add dark mode lot list picture load,NEGATIVE,-0.9990838766098022,negative
2024-03-19 16:38:14,Excellent 👌,5,0,excellent,POSITIVE,0.9998434782028198,positive
2024-03-19 15:40:57,Please allow a filter for age of property. Thanks,5,0,allow filter age property thank,POSITIVE,0.994461178779602,positive
2024-03-19 03:15:45,Search filter doesnt work. When you put in max price it still shows all of the houses outside of that price range.,2,1,search filter work max price show house outside price range,NEGATIVE,-0.9954469799995422,negative
2024-03-16 02:41:44,"Useful, efficient site. highly recommended",5,0,useful efficient site highly recommend,POSITIVE,0.9997789263725281,positive
2024-03-12 04:45:39,best real estate app I've come across!,5,0,good real estate app come,POSITIVE,0.9997649788856506,positive
2024-03-11 20:05:40,good,5,0,good,POSITIVE,0.9998161196708679,positive
2024-03-06 02:05:07,Provides great information for people looking to buy their first home,5,0,provide great information people look buy home,POSITIVE,0.9998301267623901,positive
2024-03-05 20:48:30,very informative. love it !!,5,0,informative love,POSITIVE,0.9998733997344971,positive
2024-03-05 11:52:00,Better than any other real estate application. Very impressed so far with the service.,5,0,well real estate application impressed far service,POSITIVE,0.9994550347328186,positive
2024-03-02 14:01:57,Nice,5,0,nice,POSITIVE,0.9998552799224854,positive
2024-03-02 06:03:25,This app is similar to having the same info a realtor has. I love it!!!,5,0,app similar have info realtor love,POSITIVE,0.8350914716720581,positive
2024-03-01 04:00:56,"like the app, it's great",4,0,like app great,POSITIVE,0.9997639060020447,positive
2024-02-26 22:52:05,Best app I have ever used for real estate information,5,0,good app real estate information,POSITIVE,0.9998371601104736,positive
2024-02-25 09:11:29,good one,5,0,good,POSITIVE,0.9998161196708679,positive
2024-02-23 04:52:11,great app!,5,0,great app,POSITIVE,0.999821126461029,positive
2024-02-20 19:31:27,I like the customization of searches.,5,0,like customization search,NEGATIVE,-0.8450289964675903,negative
2024-02-18 04:12:03,The app was good until it kept asking me to log in and wouldn't accept my login. I've uninstalled now.,1,1,app good keep ask log accept login uninstalle,POSITIVE,0.9024767279624939,positive
2024-02-14 20:08:59,excellent for toronto area.,5,0,excellent toronto area,POSITIVE,0.9998618364334106,positive
2024-02-13 18:37:18,overall great. sometimes you have to enter the right variation of an address to find it and that can be frustrating. very finicky at times,4,1,overall great enter right variation address find frustrating finicky time,NEGATIVE,-0.989852249622345,negative
2024-02-12 11:04:32,"There are still bugs (for Android users anyway), the watch map didn't update when new listings are posted even after refreshing. They will show up however if you click on the map. But it's a great app overall.",4,3,bug android user watch map update new listing post refresh click map great app overall,NEGATIVE,-0.9983838796615601,negative
2024-02-10 06:28:31,My trusted Real estate partner !!!! 5 star,5,0,trust real estate partner star,POSITIVE,0.9980042576789856,positive
2024-02-09 22:09:51,"My go to app for all my real estate thirst. It's amazing some realtors wonder if I am an agent, with all the information I have on any given property.😊",5,0,app real estate thirst amazing realtor wonder agent information give property,POSITIVE,0.9994719624519348,positive
2024-02-09 19:25:30,the best real estate app,5,0,good real estate app,POSITIVE,0.9998465776443481,positive
2024-02-07 00:23:38,its really good,5,0,good,POSITIVE,0.9998161196708679,positive
2024-02-05 06:07:54,more details than realtor.ca,5,0,detail realtor.ca,POSITIVE,0.9753760695457458,positive
2024-01-28 23:01:04,the sold and lease values are helpful,4,0,sell lease value helpful,POSITIVE,0.9971747398376465,positive
2024-01-28 22:03:59,Well written app. Everything organized clearly with useful stats and notifications. Especially like being able to explore property history.,5,2,write app organize clearly useful stat notification especially like able explore property history,POSITIVE,0.9970741271972656,positive
2024-01-24 23:39:07,Great 👍,3,0,great,POSITIVE,0.9998630285263062,positive
2024-01-22 21:14:30,Just an awesome app. This app works flawlessly. Good work.,5,0,awesome app app work flawlessly good work,POSITIVE,0.9998677968978882,positive
2024-01-20 07:36:38,Very well documented and updated daily.,5,0,document update daily,POSITIVE,0.9398576021194458,positive
2024-01-19 18:37:01,easy to use and a great resource,4,0,easy use great resource,POSITIVE,0.9993840456008911,positive
2024-01-16 02:49:46,"Why does this app ask me to create an account (with a password) when I already chose the ""sign in with Google"" option???",2,1,app ask create account password choose sign google option,NEGATIVE,-0.980708658695221,negative
2024-01-06 18:33:56,"Map out areas of interest, estimated values of houses, selling history, photos of expired listing. Beautiful app, please don't change.",5,2,map area interest estimate value house sell history photo expired list beautiful app change,NEGATIVE,-0.7956550121307373,negative
2024-01-05 05:15:58,The best app for rent buy and sell property,5,0,good app rent buy sell property,POSITIVE,0.9973412156105042,positive
2024-01-04 01:29:49,Best realty app I've used by a large margin.,5,0,best realty app large margin,POSITIVE,0.9996956586837769,positive
2024-01-03 03:28:57,Website has more listings than the app. App limits to 4 listings for a condo but the site shows all.,1,0,website listing app app limit listing condo site show,NEGATIVE,-0.9816061854362488,negative
2024-01-02 07:45:03,Love this app. A must for any serious home buyer investor. Easy to use. Intuitive. Very good and timely listing info.,5,2,love app home buyer investor easy use intuitive good timely list info,POSITIVE,0.9964762330055237,positive
2023-12-21 06:01:52,all the bells and whistles!,5,0,bell whistle,NEGATIVE,-0.9314956068992615,negative
2023-12-16 00:25:03,"great application, seriously saves me hours.",5,0,great application seriously save hour,POSITIVE,0.9968980550765991,positive
2023-12-13 21:30:56,good,4,0,good,POSITIVE,0.9998161196708679,positive
2023-11-19 08:01:53,It's helpful to see previous listing and sale prices. As well as seeing what other houses in the area sold for.,5,0,helpful previous listing sale price see house area sell,NEGATIVE,-0.98052978515625,negative
2023-11-16 06:34:22,great app,5,0,great app,POSITIVE,0.999821126461029,positive
2023-11-05 10:38:21,Dont need a realtor to look up history of sold prices when you have this app! So many useful info.,5,0,need realtor look history sell price app useful info,NEGATIVE,-0.9842063188552856,negative
2023-10-26 05:07:50,"works well for my purposes, has lots of features I don't necessarily need or use bubi could see being helpful to others",5,0,work purpose lot feature necessarily need use bubi helpful,NEGATIVE,-0.99439936876297,negative
2023-10-24 23:46:59,good to see the history of a location,5,0,good history location,POSITIVE,0.9998562335968018,positive
2023-10-19 21:18:40,Presenting Inaccurate market status.,1,0,present inaccurate market status,NEGATIVE,-0.9995977282524109,negative
