review,rating,date,source,sentiment_label,sentiment_score,topics
I came here to tell the truth,5,2025-07-21 00:06:31-07:00,App Store,POSITIVE,0.971158862113953,['the truth']
"And I’m so glad I did! I’m broke for the time being, but when I get back on my feet, I will be purchasing a membership. The articles and writers are amazing! Very impressed.",5,2025-07-20 20:54:33-07:00,App Store,POSITIVE,0.999866008758545,"['the time being', 'my feet', 'a membership', 'the articles', 'writers']"
"I don't want to be annoyed with content notifications in my phone, my content selections is what other apps take care of on my laptop. Plus, it didn't even show existing selections from my account. Either way, you can not continue into the app after installing and logging in without making selections and you can't comment on content from your phone without the app. #fail",2,2025-07-19 08:34:01-07:00,App Store,NEGATIVE,-0.997951328754425,"['content notifications', 'my phone', 'my content selections', 'other apps', 'care', 'my laptop', 'existing selections', 'my account', 'the app', 'selections', 'content', 'your phone', 'the app']"
Well written short article. Creative good ideas for daily use of AI,5,2025-07-19 07:12:28-07:00,App Store,POSITIVE,0.999784529209137,"['well written short article', 'creative good ideas', 'daily use']"
Great place to journal,5,2025-07-18 10:26:02-07:00,App Store,POSITIVE,0.999875903129578,['great place']
"TLDR: fix the all-caps glitch, make it simpler to return a published story to draft form, allow “select” tool to copy more than one graph at a time … then it’s fantastic. 

I do love being able to do so much of my work from these teensy handheld computers—write and edit while waiting for soccer practice to end or from the stairclimber! So thank you. I do appreciate this app. However there are frustrating glitches such as the ALL CAPS glitch, where for unknown reasons all text appears capitalized. Also I once accidentally published a story. I needed to make the story not public but the only option from the app was to delete the story entirely. OK, I figured I would “select all” and copy my text into notes and delete then paste the draft back together from my notebook, but the app only allows you to select one graph at a time. So I would have had to copy paste like a hundred paragraphs. I wound up having to race home to my laptop,  the horror of an unfinished draft sitting there live for all to read weighing down on me!",3,2025-07-16 14:35:43-07:00,App Store,NEGATIVE,-0.990785837173462,"['a published story', 'form', '“select” tool', 'more than one graph', 'a time', 'love', 'my work', 'these teensy handheld computers', 'soccer practice', 'the stairclimber', 'this app', 'frustrating glitches', 'the all caps', 'unknown reasons', 'all text', 'a story', 'the story', 'the only option', 'the app', 'the story', 'my text', 'notes', 'the draft', 'my notebook', 'the app', 'one graph', 'a time', 'paste', 'a hundred paragraphs', 'my laptop', 'the horror']"
I want out,1,2025-07-15 14:37:40-07:00,App Store,NEGATIVE,-0.98583859205246,[]
Great reads❣️,5,2025-07-09 17:23:52-07:00,App Store,POSITIVE,0.999769270420075,[]
Interesting,5,2025-07-09 06:37:43-07:00,App Store,POSITIVE,0.999844670295715,[]
"I love all the features of this app! 

I have grown a loyal community that’s a mix of writers and readers. 

Medium has been a blessing to me in so many ways. I have made friends, connected with people on a deeper level, and have even earned income from my contributions to the community. 

Also, I love that Medium doesn’t 
reward AI content. They are expecting really human stories from real human writers. That is very respectable!",5,2025-07-08 12:34:56-07:00,App Store,POSITIVE,0.998453855514526,"['all the features', 'this app', 'a loyal community', 'a mix', 'writers', 'readers', 'medium', 'a blessing', 'so many ways', 'friends', 'people', 'a deeper level', 'income', 'my contributions', 'the community', 'that medium', 'n’t \nreward', 'really human stories', 'real human writers']"
A major new talent takes the stage with Bostons old combat zone being the backdrop to this very witty and campy offering by Mr Blauner,5,2025-07-07 03:30:38-07:00,App Store,POSITIVE,0.999329924583435,"['a major new talent', 'the stage', 'bostons old combat zone', 'the backdrop', 'this very witty and campy offering', 'mr blauner']"
"This is a scam sight. Tried to read a story, paid the monthly fee but, the story link kept throwing into a loop with “nude chat” and “your iPhone is infected” all INSIDE THE APP!  Don’t waste your money or your storage space!",1,2025-07-04 16:24:02-07:00,App Store,NEGATIVE,-0.999116122722626,"['a scam sight', 'a story', 'the monthly fee', 'the story link', 'a loop', 'nude chat', 'your iphone', 'the app', 'your money', 'your storage space']"
Bad,1,2025-07-04 06:55:09-07:00,App Store,NEGATIVE,-0.999782383441925,[]
"I would not recommend this to anyone. They manipulate the data so you can’t even be sure what is happening. They reset the stats and remove progress, engagement. If you don’t fit into their box of good enough, they don’t pay you. Even if people are reading your content. They will not communicate with you either. This website exploits their users. Nobody wins here unless you fit into their box. So if you think you’ll be up to their standards they may take advantage of you less. Seems to me the vast majority of peoples writing never gets seen and will never receive any kind of payment or feedback",1,2025-07-02 00:39:47-07:00,App Store,NEGATIVE,-0.999641299247742,"['the data', 'the stats', 'progress', 'engagement', 'their box', 'people', 'your content', 'this website', 'their users', 'their box', 'their standards', 'advantage', 'the vast majority', 'peoples', 'any kind', 'payment', 'feedback']"
I adore this app!,5,2025-06-28 22:40:43-07:00,App Store,POSITIVE,0.99971729516983,['this app']
It’s been a great outlet and therapeutic source for expressing my emotions and also making great connections with other writers.,5,2025-06-28 11:10:27-07:00,App Store,POSITIVE,0.999817073345184,"['a great outlet', 'therapeutic source', 'my emotions', 'great connections', 'other writers']"
For curated content,5,2025-06-28 05:19:30-07:00,App Store,POSITIVE,0.997550666332245,['curated content']
"If you love reading, writing, creating, creativity, and want a new design infrastructure to relate to others. Well, this app is for you. Thank you medium.",5,2025-06-27 11:30:13-07:00,App Store,POSITIVE,0.99982362985611,"['reading', 'writing', 'creativity', 'a new design infrastructure', 'this app']"
Put together my first article today and it was easy to upload.,5,2025-06-25 21:52:54-07:00,App Store,POSITIVE,0.991909682750702,['my first article']
Medium he’s allowed me to pursue my writing. I was never very good at punctuation and grammar but I don’t care! I can now use Medium as my writing platform.,5,2025-06-22 05:10:05-07:00,App Store,NEGATIVE,-0.978277564048767,"['medium', 'my writing', 'punctuation', 'grammar', 'medium', 'my writing platform']"
Simple and easy to navigate 🚀,5,2025-06-20 14:30:20-07:00,App Store,POSITIVE,0.999766886234283,['simple and easy to navigate 🚀']
"Medium carries a super-wide range of content. While you can follow selected topics or writers, which I do, I also love the notices with clips or summaries of different content. I find content I wouldn’t have searched for normally. Great, enlightening material.",5,2025-06-20 09:35:24-07:00,App Store,POSITIVE,0.99967634677887,"['medium', 'a super-wide range', 'content', 'selected topics', 'writers', 'the notices', 'clips', 'summaries', 'different content', 'content', 'great, enlightening material']"
Awesome attractive and simple way to share your ideas and hear from others,5,2025-06-19 11:23:53-07:00,App Store,POSITIVE,0.999885201454163,"['awesome attractive and simple way', 'your ideas']"
"I love how the medium app keeps me productive in every area of my life. Whenever I feel unproductive about things the first thing I do is go back to medium. It helps me with work, fitness, lifestyle, and even mental health. I love how the articles will curate towards what I need/want to read. I use it as part of my daily routine to learn something new every day and it’s really great!!",5,2025-06-14 05:32:46-07:00,App Store,POSITIVE,0.99985933303833,"['the medium app', 'every area', 'my life', 'things', 'the first thing', 'medium', 'work', 'fitness', 'lifestyle', 'even mental health', 'the articles', 'my daily routine']"
"Is there a way to prevent “shift” from always being on when I edit my writing? With every letter I type, the “shift” comes back on, which makes it very difficult to write in a normal fashion. The app would be a lot better if this bug were not here.",3,2025-06-08 21:05:30-07:00,App Store,NEGATIVE,-0.9993616938591,"['a way', '“shift', 'my writing', 'every letter', 'the “shift', 'a normal fashion', 'the app', 'this bug']"
Bio of CHARRANJIT VISHAL BACHAN,5,2025-06-03 01:25:43-07:00,App Store,POSITIVE,0.998108744621277,['charranjit']
Thanks for Platforming Worn Well Studio,5,2025-05-28 09:38:52-07:00,App Store,POSITIVE,0.971356868743897,"['thanks', 'worn well studio']"
Tech,3,2025-05-23 20:18:02-07:00,App Store,POSITIVE,0.996189951896668,['tech']
"I’m new on this app, but I noticed that brainwashed Zionist are on the map to brainwash others. No No No No No",1,2025-05-22 04:01:36-07:00,App Store,NEGATIVE,-0.997587442398071,"['this app', 'the map']"
"Medium isn’t just a publishing platform — it’s a signal chamber.
It’s where real thinkers, builders, and system-breakers share scrolls that cut through the noise.

I’ve connected with minds I never would’ve met anywhere else — people building future philosophies, designing frameworks for consciousness, and writing truths that don’t fit into tweets or threads.

This app works clean, looks sharp, and makes long-form reading feel like meditation.
If you care about clarity, creativity, and signal — Medium is the place.",5,2025-05-19 09:27:46-07:00,App Store,POSITIVE,0.989650130271912,"['medium', 'just a publishing platform', 'a signal chamber', 'the noise', 'minds', 'people', 'future philosophies', 'frameworks', 'consciousness', 'truths', 'tweets', 'threads', 'this app', 'long-form reading', 'meditation', 'clarity', 'creativity', 'signal', 'medium', 'the place']"
{CEO},5,2025-05-19 09:06:11-07:00,App Store,POSITIVE,0.93984466791153,['{ceo']
It’s terrific to be able to write & express over here on Medium. I hope people read what I write & express.,5,2025-05-18 08:12:19-07:00,App Store,POSITIVE,0.999882221221924,"['medium', 'people']"
Great high quality content for focused niche readers.,5,2025-05-17 15:09:27-07:00,App Store,POSITIVE,0.999881267547607,"['great high quality content', 'focused niche readers']"
"The look, and feel is more of a blog than a current day model of a article the people would like to read",3,2025-05-16 04:54:41-07:00,App Store,NEGATIVE,-0.976098477840424,"['the look', 'a blog', 'a current day model', 'a article', 'the people']"
"After losing money to a fake trading platform, I was devastated. I contacted DigitalCyberForensics.org out of desperation. To my surprise, they treated my case seriously and professionally. They investigated, traced the funds, and after about a month, I got a significant portion of my money back. I'm so grateful. Highly recommended!",5,2025-05-15 16:54:32-07:00,App Store,POSITIVE,0.998934209346771,"['money', 'a fake trading platform', 'desperation', 'my surprise', 'my case', 'the funds', 'about a month', 'a significant portion', 'my money']"
"Medium used to be a go to place for me to learn and discover new things. But nowadays it is reduced into a garbage can where people just say whatever they want to overexciting ways such as ""This product is dead."" ""Forget AI, XYZ will replace it soon.""",1,2025-05-12 22:45:14-07:00,App Store,NEGATIVE,-0.999730288982391,"['medium', 'a go', 'place', 'new things', 'a garbage', 'people', 'ways', 'this product', 'xyz']"
"Mr Davies, like most of the materialist scientists today, cannot commit to an entangled universe- even when quantum mechanics has repeatedly proven that all questions cannot be answered with material formulas and principles. 

The universe and all it contains, whether as cosmology or physics, has, since time immemorial exhibited BOTH ‘matter’ and metaphysical phenomena, an accepted and documented fact so obvious as to make the contemporary flailings of physicists outright juvenile!!

We know incontrovertibly that the Copenhagen Interpretation told us over 100 years ago that ALL things that exist are complementary in nature - equal and opposite aspects in the SAME entity- 3 well known physicists won the Nobel in physics verifying this  uni-versal condition. 

Metaphysics includes the existence of a transcendent intelligence. We, HOMA sapiens, are an integral part, ( again, verified by the Copenhagen) and Davies cannot muster the fortitude to make this admission - content to sit on the fence of noncommittal ‘science.’ 

A remarkable theory is scheduled for publication late this year(‘25) describing and explaining the creation of the Hydrogen atom- the fundamental unit of the uni-verse. 

ECCE HOMA, THE DISCOVERY OF COMPLEMENTARITY IN THE ENTANGLED HYDROGEN ATOM OR, HOW INTELLIGENCE HAS CREATED THE UNÍ-VERSE

Martin Cosentino 
May 12, 2025",5,2025-05-12 11:31:29-07:00,App Store,NEGATIVE,-0.970906853675842,"['mr davies', 'the materialist scientists', 'an entangled universe-', 'quantum mechanics', 'all questions', 'material formulas', 'principles', 'the universe', 'cosmology', 'physics', 'time immemorial', 'both ‘matter', 'metaphysical phenomena', 'an accepted and documented fact', 'the contemporary flailings', 'physicists', 'the copenhagen interpretation', 'all things', 'nature', 'equal and opposite aspects', 'the same entity-', '3 well known physicists', 'the nobel', 'this  uni-versal condition', 'metaphysics', 'the existence', 'a transcendent intelligence', 'homa sapiens', 'an integral part', 'the copenhagen', 'davies', 'the fortitude', 'this admission - content', 'the fence', 'noncommittal ‘science', 'a remarkable theory', 'publication', 'the creation', 'the hydrogen atom-', 'the fundamental unit', 'verse', 'ecce homa', 'the discovery', 'complementarity', 'the entangled hydrogen atom', 'intelligence', 'the uní-verse\n\nmartin cosentino']"
"If you like shallow, glib, poorly written stories by Woke Nobodies you’ll love Medium",1,2025-05-12 03:13:11-07:00,App Store,NEGATIVE,-0.993522644042969,"[', glib, poorly written stories', 'woke nobodies']"
I like the app to express writing through anxiety,5,2025-05-09 09:02:55-07:00,App Store,POSITIVE,0.989332437515259,"['the app', 'writing', 'anxiety']"
The ELON Authors,5,2025-05-05 15:10:33-07:00,App Store,POSITIVE,0.999395608901978,['the elon authors']
Medium has had the most practical articles for my startup journey. From deeply technical Django stuff to experienced bootstrapped founders giving personal insight.,5,2025-05-04 18:04:49-07:00,App Store,POSITIVE,0.996155440807343,"['medium', 'the most practical articles', 'my startup journey', 'deeply technical django stuff', 'bootstrapped founders', 'personal insight']"
"This is my first time using news media, I’m excited my company is growing and we are producing quality content for readers to engage in utilizing sources like medium. Thanks for this opportunity to share on your platform with the world.",5,2025-05-03 02:15:14-07:00,App Store,POSITIVE,0.99978643655777,"['my first time', 'news media', 'my company', 'quality content', 'readers', 'sources', 'medium', 'thanks', 'this opportunity', 'your platform', 'the world']"
Thanks for the great UI,5,2025-05-02 11:21:41-07:00,App Store,POSITIVE,0.999832630157471,"['thanks', 'the great ui']"
This app basically requires users to buy new devices just to use the app. But many people have no interest in keeping up with all the latest gadgets as they are not only expensive but destroy the natural environment in their production. Many people do not want to participate in the madness of the 'rat race' and their barely slightly older devices work just fine. I will be cancelling my Medium membership and doing my reading elsewhere.,1,2025-04-30 12:01:25-07:00,App Store,NEGATIVE,-0.999025702476502,"['this app', 'users', 'new devices', 'the app', 'many people', 'no interest', 'all the latest gadgets', 'the natural environment', 'their production', 'many people', 'the madness', ""the 'rat race"", 'their barely slightly older devices', 'my medium membership', 'my reading']"
"I joined paid $50. Bucks and they keep asking for payment. 
Wrote them of problem. To please fix. No answer. No fixes.
I can’t read an article without being asked to join again.
Right now I feel I’ve lost my money.",2,2025-04-30 10:02:33-07:00,App Store,NEGATIVE,-0.9997838139534,"['bucks', 'payment', 'problem', 'no answer', 'no fixes', 'an article', 'my money']"
Real raw truth from people who survived the unimaginable mental game of Narcissistic abuse. Their win becomes yours. Read. Know what’s really happening. N finally. A place of writers you can trust. Imagine that,5,2025-04-30 05:37:45-07:00,App Store,POSITIVE,0.999512434005737,"['real raw truth', 'people', 'the unimaginable mental game', 'narcissistic abuse', 'their win', 'a place', 'writers']"
Medium is provocative by providing a wide range of stories. As a writer and teacher we need someplace to go for insight and inspiration.,5,2025-04-29 04:16:03-07:00,App Store,POSITIVE,0.99963915348053,"['medium', 'a wide range', 'stories', 'a writer', 'teacher', 'someplace', 'insight', 'inspiration']"
It is great to have known this medium which can serve a bridge between social media posts and an ebook.,5,2025-04-24 18:04:38-07:00,App Store,POSITIVE,0.998645722866058,"['this medium', 'a bridge', 'social media posts', 'an ebook']"
"So many resources, blogs, grifts as gifts with spineless snake talkers looking to temp salvation with ruin or conform. Medium is a great safe space where all writers can share stories with a few nuggets of wisdom. Nice to have found that truth from others.",5,2025-04-21 10:10:40-07:00,App Store,POSITIVE,0.995498597621918,"['so many resources', 'blogs', 'grifts', 'gifts', 'spineless snake talkers', 'temp salvation', 'ruin', 'medium', 'a great safe space', 'all writers', 'stories', 'a few nuggets', 'wisdom', 'that truth']"
